id,title,content
11,"福建舰将进入海试阶段，004也传来好消息，台专家预言或成现实","据官方消息透露，中国海军近来频繁传出好消息。针对福建舰，已完成动力测试和系泊试验，这也为福建舰的下一步海试做好了充分准备。一旦进入海试阶段，福建舰很快就将投入实际使用。这样一来，中国的三航母时代才真正来临。弹射型设计方便飞机起飞福建舰是中国的第三艘航母，它也是第二艘自主研制的航母。在福建舰的自主研发过程中，弹射型技术得到了首次应用，从而让福建舰成为了中国第一艘采用弹射型技术的航母。与辽宁舰和山东舰不同的是，福建舰甲板没有曲度，这是因为舰载机使用弹射起飞方式，而不是滑跃起飞方式。弹射器起飞需要更高速度和更长甲板，因此福建舰甲板平整而宽敞。这对中国航母事业的发展具有重要意义。"
12,"以色列刚放出狠话，巴勒斯坦469枚火箭弹就射出，铁穹系统难拦截","作为全球政治和经济重要的交通枢纽，中东地区的和平与稳定对于整个世界都具有十分重要的意义。近日，中东地区的局势发生了巨大的变化。以色列突如其来的攻击行动给地区的和平带来了严重的威胁。在得到国际社会多方调解的协助后，以色列和巴勒斯坦杰哈德组织达成了一个短暂的停火协议。然而，5天之后，以色列不顾协议再次对巴勒斯坦进行了空袭，这说明停火达成的目的并未得到真正的实现。据俄罗斯媒体报道，以色列国防军宣布，5月10日，巴勒斯坦的杰哈德武装发射了共469枚火箭弹，其中333枚进入以色列境内。铁穹系统成功拦截了100多枚，但仍有数枚火箭弹袭击了以色列住宅区。剩余的火箭弹大部分落在无人区，还有100多枚落在加沙地区并未造成伤亡。"
13,"中芯国际一季度净利下滑44%","2023年5月11日晚，中国半导体公司中芯国际公布了2023年第一季度的业绩。数据显示，这家公司今年一季度的营业收入为102.09亿元，同比下降了13.9%。净利润则为15.91亿元，同比下降了44%。这样的结果主要是由于晶圆销售量减少及产能利用率下滑背景下，归属于上市公司股东的扣除非降所致。在半导体制造过程中，产能利用率是一个非常关键的指标。在产品需求不足的情况下，生产企业可能会不得不减少产能利用率以避免库存积压。此外，由于全球半导体市场上的供应链问题，中芯国际也可能遇到了生产设备、原材料和其他必要资源的短缺问题，这也可能导致产能利用率下降。"
14,"耶伦反驳特朗普关于债务违约发言：不堪设想，美国永远不该违约","在这场不寻常的节目里，当被问到对美国债务状况的看法时，特朗普表示，如果民主党人不同意开支削减方案，共和党人不如一不做二不休，干脆让债务违约发生，逼迫民主党人做出让步。特朗普称，他认为债务违约不会发生，因为“民主党人绝对会屈服”。说起债务违约的后果，他说：“这真的是心理上的（问题），而不是其他任何问题。它可能真的很糟糕，也可能没什么，也许会导致糟糕的一周，或者糟糕的一天，谁知道呢？”这话被一些美媒批评是试图淡化违约后果。"
15,"90后运动员受伤后退役卖水果：因半月板撕裂退役 最近开始摆摊赚钱养家","近日，一名90后的跆拳道女运动员娜娜摆摊卖水果，走红社交网络平台。娜娜透露自己是因为半月板撕裂受伤退役，最近开始摆摊，赚钱养家，自食其力。娜娜卖水果每天还会给自己定一个小目标，有时候是要卖100元，有时候是给自己买一瓶防脱洗发水。"
16,"以色列总理刚放出狠话，向伊朗发出战争威胁，俄媒评论扎心","据环球网3月7日报道，以色列总理内塔尼亚胡此前一天在参加海法一个海军学院毕业典礼时，对伊朗通过海上秘密运输石油一事进行了强烈谴责。内塔尼亚胡表示，以色列海军已经做好了拦截伊朗海上运输船只的准备。与此同时，以总理还呼吁其他国家一起联合起来制止伊朗这种“非法”行为。此举无异于是在进行战争宣示，一不小心就有可能擦枪走火。众所周知，伊朗和以色列这两家原本就有血海深仇。以总理如此表态，只会让两国矛盾变得更加尖锐。"
17,"以色列在加沙发起军事行动，中东协调员呼吁避免局势升级","更令以色列担忧的是，随着联合国对伊朗武器禁令的结束，伊朗也开始主动向中俄释放想购买武器的信号。伊朗当下最中意的便是中国的歼-10C以及俄罗斯的苏-35这两款战机，一旦伊朗能够成建制的引进这两型战机无疑会迅速提升伊朗空军的整体战力。"
18,"一名以色列人在火箭弹袭击中死亡","从9日凌晨起，以军对加沙地带发动多轮空袭。据巴勒斯坦官方通讯社“瓦法”11日报道，空袭已造成29名巴勒斯坦人死亡、90多人受伤。自10日午后，以色列南部和中部多个城市均报告遭到来自加沙地带的火箭弹袭击。"
19,"以色列首次对半岛电视台女记者遇害事件道歉","当地时间5月11日，以色列国防军发言人丹尼尔·哈加里在接受美国媒体采访时，首次就半岛电视台女记者希琳·阿布·阿格莱一年前在约旦河西岸北部城市杰宁遇害事件道歉。2022年5月11日，希琳在报道以色列军队和巴勒斯坦人在杰宁难民营的冲突时不幸中弹身亡。巴勒斯坦方面称她是被一名以色列士兵杀害，此事引发了国际社会的广泛谴责"